<window xmlns:xsi="http://www.w3.org/2001/XMLSchema-instance"
        inherit="minecolonies:gui/windowBase.xml"
        xsi:noNamespaceSchemaLocation="file:../../../../java/com/blockout/blockOut.xsd">
    <switch id="pages" size="100% 200px" pos="0 7">
        <view id="pageActions" size="100% 100%">
            <layout source="minecolonies:gui/layoutWorkerBuildingDefault.xml"/>
        </view>
        <view id="pageSettings" size="100% 100%" pos="0 1">

            <view size="100% 100" pos="0 0">
                <label size="100% 11" pos="0 0"
                       label="Plant" color="black" textalign="BottomMiddle"/>

                <view size="100% 100" pos="0 16">
                    <itemicon size="20 20" pos="33 2" item="wheat"/>
                    <button size="30 20" pos="52 0" id="wheat"/>

                    <itemicon size="20 20" pos="90 2" item="potato"/>
                    <button size="30 20" pos="109 0" id="potato"/>

                    <itemicon size="20 20" pos="33 26" item="carrot"/>
                    <button size="30 20" pos="52 24" id="carrot"/>

                    <itemicon size="20 20" pos="90 26" item="melon"/>
                    <button size="30 20" pos="109 24" id="melon"/>

                    <itemicon size="20 20" pos="50 50" item="pumpkin"/>
                    <button size="30 20" pos="69 48" id="pumpkin"/>
                </view>
            </view>

        </view>
    </switch>

    <button id="prevPage" align="TopLeft" size="20 20" pos="10 5" label="&lt;&lt;"/>
    <button id="nextPage" align="TopRight" size="20 20" pos="10 5" label="&gt;&gt;"/>

    <button id="inventory"
            align="BottomMiddle" size="116 20" pos="0 13"
            label="$(container.inventory)"/>
</window>
