<window xmlns:xsi="http://www.w3.org/2001/XMLSchema-instance" size="290 244"
        xsi:noNamespaceSchemaLocation="file:../../../../../../java/com/minecolonies/blockout/blockOut.xsd">
    <image source="minecolonies:textures/gui/citizen/colonist_papper_sketch.png" size="190 244"/>

    <label id="name" size="100% 11" color="black" pos="50 14"/>
    <image id="deco1" size="82 16" source="minecolonies:textures/gui/citizen/colonist_text_decor_down.png" pos="50 29"/>

    <view id="healthBar" size="100% 11" pos="30 42"/>
    <view id="saturationBar" size="100% 11" pos="30 54"/>
    <view id="xpBar" size="100% 11" pos="30 66"/>
    <label id="xpLabel" size="100% 11" color="black" pos="145 72"/> 
    <view id="happinessBar" size="100% 11" pos="30 72"/> 
    <label id="happinessLabel" size="100% 11" color="black" pos="145 83"/> 
    
    <image id="deco2" size="73 16" pos="16 99"
        source="minecolonies:textures/gui/citizen/colonist_decor_down.png"/>
    <label id="title" size="100% 11" pos="40 107" color="black"
        label="Â§l$(com.minecolonies.coremod.gui.citizen.skills)"/>
    <group size="100% 100%" pos="22 119">
        <label id="strength" size="100% 11" color="black"/>
        <label id="endurance" size="100% 11" color="black"/>
        <label id="charisma" size="100% 11" color="black"/>
        <label id="intelligence" size="100% 11" color="black"/>
        <label id="dexterity" size="100% 11" color="black"/>
    </group>
    <image id="deco3" size="73 16" pos="16 172"
        source="minecolonies:textures/gui/citizen/colonist_decor_up.png"/>

    <buttonimage id="requestsTitle" size="80 48" pos="195 64" label="$(com.minecolonies.coremod.gui.citizen.requestTitle)"
                source="minecolonies:textures/gui/citizen/colonist_request_button.png" textcolor="black"/>
    <buttonimage id="inventory" size="80 49" pos="195 119" label="$(container.inventory)"
                source="minecolonies:textures/gui/citizen/colonist_inventory_button.png" textcolor="black" shadow="false"/>

    <image id="deco4" size="15 49" pos="37 194"
        source="minecolonies:textures/gui/citizen/colonist_decor_up_ribbon_smaller.png"/>
    <image id="gender" size="30 30" pos="30 189"
        source="minecolonies:textures/gui/citizen/colonist_wax_male_smaller.png"/>
</window>