<layout xmlns:xsi="http://www.w3.org/2001/XMLSchema-instance"
        xsi:noNamespaceSchemaLocation="file:../../../../java/com/minecolonies/blockout/blockOut.xsd">
    <label id="name" size="100% 11" pos="0 0"
           textalign="MIDDLE" color="red"/>
    <label size="100% 11" pos="0 18"
           label="$(com.minecolonies.coremod.gui.workerHuts.workerAssigned)"
           textalign="MIDDLE" color="black"/>
    <label id="workerName" size="100% 11" pos="0 28"
           textalign="MIDDLE" color="black"/>
    <label id="workerLevel" size="100% 11" pos="0 44"
           textalign="MIDDLE" color="black"/>

    <button id="hire" align="TOP_MIDDLE" size="116 20" pos="0 60"
            label="$(com.minecolonies.coremod.gui.workerHuts.hire)"/>
    <button id="recall" align="TOP_MIDDLE" size="116 20" pos="0 82"
            label="$(com.minecolonies.coremod.gui.workerHuts.recall)"/>
    <button id="build" align="TOP_MIDDLE" size="116 20" pos="0 104"
            label="$(com.minecolonies.coremod.gui.workerHuts.upgrade)"/>
    <button id="repair" align="TOP_MIDDLE" size="116 20" pos="0 126"
            label="$(com.minecolonies.coremod.gui.workerHuts.repair)"/>
    <button id="recipelist" align="TOP_MIDDLE" size="116 20" pos="0 150"
            label="$(com.minecolonies.coremod.gui.workerHuts.listRecipes)"/>
    <button id="crafting" align="TOP_MIDDLE" size="116 20" pos="0 172"
            label="$(com.minecolonies.coremod.gui.workerHuts.crafting)"/>
</layout>
