<window xmlns:xsi="http://www.w3.org/2001/XMLSchema-instance"
        inherit="minecolonies:gui/windowBase.xml"
        xsi:noNamespaceSchemaLocation="file:../../../../java/com/blockout/blockOut.xsd">
    <label id="title"
           size="100% 11" pos="0 9"
           textalign="TopMiddle"
           color="0"
           label="$(com.minecolonies.gui.citizen.skills)"/>
    <group width="100" height="55" x="30" y="30">
        <label id="strength"
               width="100%" height="11"
               color="0"/>
        <label id="stamina"
               width="100%" height="11"
               color="black"/>
        <label id="wisdom"
               width="100%" height="11"
               color="#ff0000"/>
        <!-- label id="intelligence"
               width="100%" height="11"
               color="rgb(255,0,0)" />
        <label id="charisma"
               width="100%" height="11"
               color="rgba(0,255,0,0.5)" / -->
        <itemicon item="gold_ingot"/>
    </group>
    <view size="80% 60" y="85" align="TopMiddle">
        <input id="text1"
               size="100% 20" y="0" text="This is just a test"
               tab="text2"/>
        <input id="text2"
               size="100% 20" y="20" text="This is just a test"
               tab="text1"/>
    </view>
    <!-- box padding="3" size="100 85" y="128" align="TopMiddle">
        <list id="scrollgroup"
              size="100%">
            <view size="100% 45px">
                <label id="listlabel" width="-35" height="11" color="black" hovercolor="white" label="1" />
                <button id="listbutton" width="30" height="11" x="5" y="0" align="TopRight" label="B" />
                <list id="scrollgroup2" width="100%" height="30" y="12">
                    <label id="listlabel2" height="11" color="black" hovercolor="white" label="1" />
                </list>
            </view>
        </list>
    </box -->
    <box size="80% 85" pos="0 128" align="TopMiddle">
        <text size="100% 100%" color="black" textscale="1.0">
            This is just a test of text!
            The text has multiple lines...
            So let's see if it really works...
            It should also wrap on it's own.
        </text>
    </box>

    <button id="inventory"
            align="BottomMiddle" size="116 20" pos="0 13"
            label="$(container.inventory)"/>
</window>
