<window xmlns:xsi="http://www.w3.org/2001/XMLSchema-instance" pause="true"
        lightbox="true"
        xsi:noNamespaceSchemaLocation="file:../../../../java/com/minecolonies/blockout/blockOut.xsd">

    <label size="100% 11" pos="0 50" textalign="TOP_MIDDLE" color="white" label="$(com.minecolonies.coremod.gui.workerHuts.listRecipes)"/>
    <list id="recipes" size="70% 120" pos="60 70" align="TOP_MIDDLE">
        <view size="70% 50">
            <itemicon id="output" size="16 16" pos="80 5"/>
            <box id="2x2" size="100% 30" linewidth="2">
                <itemicon id="resource1" size="16 16" pos="20 1"/>
                <itemicon id="resource2" size="16 16" pos="20 15"/>
                <itemicon id="resource3" size="16 16" pos="34 15"/>
                <itemicon id="resource4" size="16 16" pos="34 1"/>
            </box>
            <box id="3x3" size="100% 50" linewidth="2" visible="false">
                <itemicon id="res1" size="16 16" pos="20 1"/>
                <itemicon id="res2" size="16 16" pos="34 1"/>
                <itemicon id="res3" size="16 16" pos="48 1"/>

                <itemicon id="res4" size="16 16" pos="20 15"/>
                <itemicon id="res5" size="16 16" pos="34 15"/>
                <itemicon id="res6" size="16 16" pos="48 15"/>

                <itemicon id="res7" size="16 16" pos="20 29"/>
                <itemicon id="res8" size="16 16" pos="34 29"/>
                <itemicon id="res9" size="16 16" pos="48 29"/>
            </box>
            <button id="up" size="15 15" label="↥" pos="0 0"/>
            <button id="down" size="15 15" label="↧" pos="0 15"/>
            <button id="remove" size="45 15" pos="125 3" label="$(com.minecolonies.coremod.gui.recipe.remove)"/>
        </view>
    </list>
    <button id="cancel" size="200 20" pos="110 194" label="$(gui.cancel)"/>
</window>
