<window xmlns:xsi="http://www.w3.org/2001/XMLSchema-instance" size="190 244" pause="false"
        lightbox="false"
        xsi:noNamespaceSchemaLocation="file:../../../../../api/java/com/minecolonies/blockout/blockOut.xsd">
    <switch id="pages" size="100% 100%">
        <view id="pageActions" size="100% 100%">
            <layout source="minecolonies:gui/layouthuts/layouthutpageactionsmin.xml"/>
        </view>
        <view id="resourceActions" size="100% 100%">
            <image source="minecolonies:textures/gui/builderhut/builder_papper.png" size="190 244"/>
            <label size="130 11" pos="30 14" textalign="MIDDLE" color="black"
                   label="$(com.minecolonies.coremod.gui.warehouse.upgrade)"/>
            <box size="164 30" linewidth="2" pos="13 29">
                <itemicon id="resourceIcon" size="16 16" pos="1 1"/>
                <label id="resourceName" size="125 9" pos="18 2" color="black"/>
                <button id="resourceAdd" size="16 16" label="â†¥" pos="145 2"/>
                <label id="resourceMissing" size="65 9" pos="2 20" textalign="MIDDLE" color="black"/>
                <label id="resourceAvailableNeeded" size="65 9" pos="67 20" textalign="MIDDLE" color="black"/>
                <label id="upgradeProgress" size="40 9" pos="132 20" color="black"/>

                <label id="resourceId" size="1 1" pos="100 100"/>
                <label id="resourceQuantity" size="1 1" pos="100 100"/>
            </box>
            <buttonimage id="sort" size="86 17" pos="50 70" textcolor="black"
                         source="minecolonies:textures/gui/builderhut/builder_button_medium.png"
                         disabled="minecolonies:textures/gui/builderhut/builder_button_medium_large_disabled.png"
                         label="$(com.minecolonies.coremod.gui.warehouse.sort)"/>
        </view>
        <view>
            <image source="minecolonies:textures/gui/builderhut/builder_papper.png" size="190 244"/>
            <label size="130 11" pos="30 14" textalign="MIDDLE" color="black"
                   label="$(com.minecolonies.coremod.gui.warehouse.stock)"/>
            <list id="resources" size="170 100" pos="13 50">
                <box size="100% 17" linewidth="2">
                    <itemicon id="resourceIcon" size="17 17" pos="0 0"/>
                    <label id="resourceName" size="90 12" pos="20 1" color="black"/>
                    <label id="resourceQty" size="12 12" pos="115 1" color="black"/>

                    <buttonimage label="X" id="removeStock" pos="130 1" size="29 15"
                                 source="minecolonies:textures/gui/builderhut/builder_button_very_small.png" textcolor="red"/>
                </box>
            </list>
            <buttonimage id="addStock" size="86 17" pos="50 160" textcolor="black"
                         source="minecolonies:textures/gui/builderhut/builder_button_medium.png"
                         label="$(com.minecolonies.coremod.gui.warehouse.add)"/>
        </view>
    </switch>
    <buttonimage id="prevPage" size="18 10" pos="13 13" source="minecolonies:textures/gui/builderhut/turn_page_left.png"/>
    <buttonimage id="nextPage" size="18 10" pos="159 13" source="minecolonies:textures/gui/builderhut/turn_page_right.png"/>
    <label id="pageNum" size="20 11" pos="158 222" textalign="MIDDLE" label="" color="black"/>
</window>