<window xmlns:xsi="http://www.w3.org/2001/XMLSchema-instance" size="190 244" pause="false"
        lightbox="false"
        xsi:noNamespaceSchemaLocation="file:../../../../../api/java/com/minecolonies/blockout/blockOut.xsd">
    <switch id="pages" size="100% 100%">
        <view id="pageActions" size="100% 100%">
            <layout source="minecolonies:gui/layouthuts/layouthutpageactions.xml"/>
        </view>
        <view id="pageItems" size="100% 100%">
            <image source="minecolonies:textures/gui/builderhut/builder_papper.png" size="190 244"/>
            <label id="desc" size="130 11" pos="30 14" color="black" textalign="MIDDLE"/>
            <input id="input" size="150 18" pos="20 30" maxlength="25"/>

            <list id="resources" size="164 136" pos="13 50">
                <box size="100% 17" linewidth="2">
                    <itemicon id="resourceIcon" size="17 17" pos="0 0"/>
                    <label id="resourceName" size="100 12" pos="20 1" color="white"/>
                    <buttonimage label="$(com.minecolonies.coremod.gui.workerHuts.retrieveOn)" id="switch" pos="120 1" size="29 15"
                                 source="minecolonies:textures/gui/builderhut/builder_button_very_small.png" textcolor="black"/>
                </box>
            </list>
        </view>
    </switch>
    <buttonimage id="prevPage" size="18 10" pos="13 13" source="minecolonies:textures/gui/builderhut/turn_page_left.png"/>
    <buttonimage id="nextPage" size="18 10" pos="159 13" source="minecolonies:textures/gui/builderhut/turn_page_right.png"/>
    <label id="pageNum" size="20 11" pos="158 222" textalign="MIDDLE" label="" color="black"/>
</window>